{
  "id": "fullbody_a",
  "nome": "Full Body A",
  "descrizione": "Esempio Full Body",
  "giorni": [
    {
      "giorno": "Lunedì",
      "etichetta": "Giorno 1",
      "esercizi": [
        {"id":"squat","nome":"Squat","serie":4,"reps":"6-8","recupero":120,"note":"Bilanciere"},
        {"id":"bench","nome":"Bench Press","serie":4,"reps":"6-8","recupero":120}
      ]
    },
    {
      "giorno": "Martedì",
      "etichetta": "Push",
      "esercizi": [
        {"id":"bench","nome":"Bench Press","serie":4,"reps":"6-8","recupero":90},
        {"id":"ohp","nome":"Overhead Press","serie":3,"reps":"6-8","recupero":90}
      ]
    },
    {
      "giorno": "Mercoledì",
      "etichetta": "Pull",
      "esercizi": [
        {"id":"deadlift","nome":"Deadlift","serie":4,"reps":"5","recupero":180},
        {"id":"pullup","nome":"Pull-up","serie":4,"reps":"6-8","recupero":120}
      ]
    }
  ]
}
