{
  "id": "forzebase_02_02_2026",
  "nome": "ForzeBase",
  "descrizione": "Secondo microciclo di ForzeBase, progressione 5x5 per i principali compound",
  "categoria": "Forza",
  "giorni": [
    {
      "giorno": "Push",
      "etichetta": "Push — 5x5",
      "esercizi": [
        { "id": "panca_piana", "nome": "Panca Piana", "serie": 5, "reps": "5", "recupero": 240, "video": "https://www.youtube.com/watch?v=panca5x5_001", "note": "Progressione 5x5 – aumenta 2.5kg a settimana" },
        { "id": "overhead_press", "nome": "Overhead Press", "serie": 5, "reps": "5", "recupero": 180, "video": "https://www.youtube.com/watch?v=ohp002", "note": "Bilanciere, in piedi" },
        { "id": "dip", "nome": "Dip alle Parallele", "serie": 3, "reps": "8-12", "recupero": 120, "video": "https://www.youtube.com/watch?v=dips003", "note": "Corpo verticale" },
        { "id": "alzate_lat", "nome": "Alzate Laterali", "serie": 4, "reps": "15", "recupero": 60, "video": "https://www.youtube.com/watch?v=latraise004", "note": "Leggero, focus sul pump" }
      ]
    },
    {
      "giorno": "Pull",
      "etichetta": "Pull — 5x5",
      "esercizi": [
        { "id": "stacco", "nome": "Stacco da Terra", "serie": 5, "reps": "5", "recupero": 300, "video": "https://www.youtube.com/watch?v=deadlift5x5_004", "note": "Progressione 5x5" },
        { "id": "trazioni_lastex", "nome": "Trazioni con Lastex", "serie": 4, "reps": "6-8", "recupero": 120, "video": "https://www.youtube.com/watch?v=lastex005", "note": "Assistite se necessario" },
        { "id": "lat_machine", "nome": "Lat Machine", "serie": 3, "reps": "10-12", "recupero": 90, "video": "https://www.youtube.com/watch?v=lat006", "note": "Presa larga" },
        { "id": "curl_bilanciere", "nome": "Curl Bilanciere", "serie": 4, "reps": "8", "recupero": 75, "video": "https://www.youtube.com/watch?v=curl007", "note": "Progressione lineare" }
      ]
    },
    {
      "giorno": "Gambe & Core",
      "etichetta": "Legs & Core",
      "esercizi": [
        { "id": "squat", "nome": "Squat", "serie": 5, "reps": "5", "recupero": 300, "video": "https://www.youtube.com/watch?v=squat5x5_008", "note": "Progressione 5x5" },
        { "id": "leg_press", "nome": "Leg Press", "serie": 3, "reps": "12", "recupero": 120, "video": "https://www.youtube.com/watch?v=legpress009", "note": "Supplementare allo squat" },
        { "id": "leg_curl", "nome": "Leg Curl", "serie": 3, "reps": "12", "recupero": 90, "video": "https://www.youtube.com/watch?v=legcurl010", "note": "Curl sdraiato" },
        { "id": "plank", "nome": "Plank", "serie": 4, "reps": "60s", "recupero": 60, "video": null, "note": "Addome contratto" },
        { "id": "russian_twist", "nome": "Russian Twist", "serie": 3, "reps": "20", "recupero": 45, "video": null, "note": "Con disco o kettlebell" }
      ]
    }
  ]
}
