{
  "id": "legs_a",
  "nome": "Legs A",
  "categoria": "Legs",
  "descrizione": "Gambe e glutei",
  "giorni": [
    {
      "giorno": "Mercoledì",
      "etichetta": "Legs A — Settimana 1",
      "esercizi": [
        { "id": "squat",         "nome": "Squat",                "serie": 4, "reps": "6-8",        "recupero": 150, "video": "https://www.youtube.com/watch?v=squat_demo", "note": "Bilanciere in barra, scendi a 90° o più in basso" },
        { "id": "leg_press",    "nome": "Leg Press",            "serie": 3, "reps": "10-12",      "recupero": 90,  "video": "https://www.youtube.com/watch?v=legpress_demo", "note": "Piedi a larghezza spalle, non bloccare le ginocchia" },
        { "id": "affondi",      "nome": "Affondi Camminate",    "serie": 3, "reps": "12 per gamba","recupero": 75,  "video": "https://www.youtube.com/watch?v=lunge_demo", "note": "Manubri, ginocchio posteriore sfiora il suolo" },
        { "id": "leg_curl",     "nome": "Leg Curl",             "serie": 3, "reps": "12-15",      "recupero": 60,  "video": "https://www.youtube.com/watch?v=legcurl_demo", "note": "Curl sdraiato, fase eccentrica lenta" },
        { "id": "calf_raise",   "nome": "Calf Raise",           "serie": 4, "reps": "15-20",      "recupero": 45,  "video": "https://www.youtube.com/watch?v=calf_demo", "note": "In piedi, pausa 1s in cima" }
      ]
    },
    {
      "giorno": "Sabato",
      "etichetta": "Legs A — Settimana 2",
      "esercizi": [
        { "id": "hip_thrust",    "nome": "Hip Thrust",           "serie": 4, "reps": "8-12",  "recupero": 90,  "video": "https://www.youtube.com/watch?v=hipthrust_demo", "note": "Bilanciere o macchina, strizza i glutei in alto" },
        { "id": "hack_squat",   "nome": "Hack Squat",           "serie": 3, "reps": "10-12", "recupero": 90,  "video": "https://www.youtube.com/watch?v=hacksquat_demo", "note": "Piedi alti sul piattaforma per più gluteo" },
        { "id": "leg_extension","nome": "Leg Extension",        "serie": 3, "reps": "15-20", "recupero": 45,  "video": "https://www.youtube.com/watch?v=legext_demo", "note": "Full ROM, pausa 1s in estensione" },
        { "id": "good_morning", "nome": "Good Morning",         "serie": 3, "reps": "12-15", "recupero": 60,  "video": "https://www.youtube.com/watch?v=goodmorning_demo", "note": "Bilanciere leggero, schiena neutra" },
        { "id": "seated_calf",  "nome": "Seated Calf Raise",    "serie": 4, "reps": "15-20", "recupero": 45,  "video": "https://www.youtube.com/watch?v=seatedcalf_demo", "note": "Isola il soleo, pausa in basso per stretching" }
      ]
    }
  ]
}
