{
  "id": "push_a",
  "nome": "Push A",
  "categoria": "Push",
  "descrizione": "Petto, spalle e tricipiti",
  "giorni": [
    {
      "giorno": "Lunedì",
      "etichetta": "Push A — Settimana 1",
      "esercizi": [
        { "id": "panca_piana",    "nome": "Panca Piana",       "serie": 4, "reps": "6-8",   "recupero": 120, "video": "https://www.youtube.com/watch?v=panca_demo", "note": "Bilanciere, presa leggermente più larga delle spalle" },
        { "id": "shoulder_press","nome": "Shoulder Press",    "serie": 3, "reps": "8-10",  "recupero": 90,  "video": "https://www.youtube.com/watch?v=ohp_demo", "note": "Manubri, seduto con schiena supportata" },
        { "id": "pec_deck",      "nome": "Pec Deck",          "serie": 3, "reps": "10-12", "recupero": 60,  "video": "https://www.youtube.com/watch?v=pecdeck_demo", "note": "Porta il gomito in linea con la spalla" },
        { "id": "lat_raise",     "nome": "Lateral Raise",     "serie": 4, "reps": "12-15", "recupero": 45,  "video": "https://www.youtube.com/watch?v=lateral_demo", "note": "Leggero bend del gomito" },
        { "id": "tricep_rope",   "nome": "Tricep Rope",       "serie": 3, "reps": "12-15", "recupero": 60,  "video": "https://www.youtube.com/watch?v=rope_demo", "note": "Apertura finale delle mani in basso" }
      ]
    },
    {
      "giorno": "Giovedì",
      "etichetta": "Push A — Settimana 2",
      "esercizi": [
        { "id": "panca_inclinata","nome": "Panca Inclinata",   "serie": 4, "reps": "8-10",  "recupero": 120, "video": "https://www.youtube.com/watch?v=incline_demo", "note": "30° di inclinazione" },
        { "id": "arnold_press",  "nome": "Arnold Press",      "serie": 3, "reps": "10-12", "recupero": 90,  "video": "https://www.youtube.com/watch?v=arnold_demo", "note": "Rotazione del polso durante la spinta" },
        { "id": "cable_fly",     "nome": "Cable Fly",         "serie": 3, "reps": "12-15", "recupero": 60,  "video": "https://www.youtube.com/watch?v=cablefly_demo", "note": "Cavi alti" },
        { "id": "front_raise",   "nome": "Front Raise",       "serie": 3, "reps": "12-15", "recupero": 45,  "video": "https://www.youtube.com/watch?v=front_demo", "note": "Alternato" },
        { "id": "skullcrusher",  "nome": "Skull Crusher",     "serie": 3, "reps": "10-12", "recupero": 75,  "video": "https://www.youtube.com/watch?v=skull_demo", "note": "EZ-bar, abbassa dietro la testa" }
      ]
    }
  ]
}
