{
  "id": "athlon_01_05_2026",
  "nome": "ATHLON",
  "descrizione": "Programma ATHLON: split Push/Pull/Legs, versione adattata 2026",
  "categoria": "PPL",
  "giorni": [
    {
      "giorno": "Push",
      "etichetta": "Push Day",
      "esercizi": [
        { "id": "cardio_push", "nome": "Cardio iniziale", "serie": 1, "reps": "5-10 min", "recupero": null, "video": null, "note": "Tapis roulant o cyclette a intensità moderata" },
        { "id": "chest_press_mac", "nome": "Chest Press alla macchina", "serie": 4, "reps": "6-8", "recupero": 12, "video": "https://www.youtube.com/watch?v=abcd1234", "note": "Machine Chest Press – controllo fase eccentrica" },
        { "id": "floor_press", "nome": "Distensioni panca piana / Floor Press", "serie": 3, "reps": "8-10", "recupero": 12, "video": "https://www.youtube.com/watch?v=efgh5678", "note": "DB Flat Bench o Floor Press – gomiti non troppo larghi" },
        { "id": "panca_inclinata", "nome": "Panca inclinata con manubri", "serie": 3, "reps": "10-12", "recupero": 90, "video": "https://www.youtube.com/watch?v=ijkl9012", "note": "Low-Incline DB Press – massima apertura in basso" },
        { "id": "alzate_laterali", "nome": "Alzate laterali", "serie": 4, "reps": "12-15", "recupero": 60, "video": "https://www.youtube.com/watch?v=lmno3456", "note": "Manubri o cavi – braccio leggermente avanti" },
        { "id": "y_raise_facepull", "nome": "Y-raise ai cavi / Face Pull", "serie": 3, "reps": "15-20", "recupero": 60, "video": "https://www.youtube.com/watch?v=face0001", "note": "Lavoro di cuffia e parte alta schiena" },
        { "id": "rope_pushdown", "nome": "Spinte in basso al cavo con corda", "serie": 3, "reps": "10-12", "recupero": 60, "video": "https://www.youtube.com/watch?v=rope2222", "note": "Rope Pushdown – gomiti fermi ai fianchi" },
        { "id": "overhead_tric", "nome": "Estensioni tricipiti sopra la testa", "serie": 2, "reps": "12-15", "recupero": 60, "video": "https://www.youtube.com/watch?v=tric3333", "note": "Overhead Tricep Extension – manubrio singolo o cavo" }
      ]
    },
    {
      "giorno": "Pull",
      "etichetta": "Pull Day",
      "esercizi": [
        { "id": "cardio_pull", "nome": "Cardio iniziale", "serie": 1, "reps": "5-10 min", "recupero": null, "video": null, "note": "Tapis roulant o cyclette" },
        { "id": "trazioni", "nome": "Trazioni (presa neutra o supina)", "serie": 4, "reps": "6-8", "recupero": 12, "video": "https://www.youtube.com/watch?v=pull4444", "note": "Pull-Up – presa neutra o supina" },
        { "id": "lat_machine", "nome": "Lat machine presa neutra/stretta", "serie": 3, "reps": "8-10", "recupero": 90, "video": "https://www.youtube.com/watch?v=lat5555", "note": "Lat Pulldown – scapole che scendono" },
        { "id": "chest_sup_row", "nome": "Rematore su panca inclinata", "serie": 3, "reps": "8-10", "recupero": 90, "video": "https://www.youtube.com/watch?v=row6666", "note": "Chest-Supported Row – presa neutra" },
        { "id": "cable_row_singolo", "nome": "Rematore singolo al cavo", "serie": 3, "reps": "10-12", "recupero": 75, "video": "https://www.youtube.com/watch?v=cable7777", "note": "Single-Arm Cable Row – per lato" },
        { "id": "rear_delt", "nome": "Alzate posteriori ai cavi / Pec Deck", "serie": 3, "reps": "15-20", "recupero": 60, "video": "https://www.youtube.com/watch?v=rear8888", "note": "Rear Delt Flyes – leggero" },
        { "id": "stacco_rumeno", "nome": "Stacco rumeno", "serie": 3, "reps": "6-8", "recupero": 12, "video": "https://www.youtube.com/watch?v=rdl9999", "note": "Romanian Deadlift – schiena neutra" },
        { "id": "curl_ez", "nome": "Curl con bilanciere EZ", "serie": 3, "reps": "8-10", "recupero": 60, "video": "https://www.youtube.com/watch?v=curl1010", "note": "Bicep EZ Bar Curl – no slancio" },
        { "id": "curl_incline", "nome": "Curl con manubri su panca inclinata", "serie": 2, "reps": "10-12", "recupero": 60, "video": "https://www.youtube.com/watch?v=curl1212", "note": "Incline DB Curl – massimo stiramento" }
      ]
    },
    {
      "giorno": "Legs",
      "etichetta": "Legs Day",
      "esercizi": [
        { "id": "cardio_legs", "nome": "Cardio iniziale", "serie": 1, "reps": "5-10 min", "recupero": null, "video": null, "note": "Tapis roulant o cyclette" },
        { "id": "squat", "nome": "Squat con bilanciere / Safety Bar", "serie": 4, "reps": "5-6", "recupero": 180, "video": "https://www.youtube.com/watch?v=squat1313", "note": "Back Squat – sotto il parallelo" },
        { "id": "leg_press", "nome": "Leg press", "serie": 3, "reps": "10-12", "recupero": 90, "video": "https://www.youtube.com/watch?v=legpress1414", "note": "Orizzontale o 45° – piedi a larghezza spalle" },
        { "id": "squat_bulgaro", "nome": "Squat bulgaro con manubri", "serie": 3, "reps": "8-10 per gamba", "recupero": 90, "video": "https://www.youtube.com/watch?v=bulgaro1515", "note": "Bulgarian Split Squat – piede posteriore su panca" },
        { "id": "rdl_leg_curl", "nome": "Stacco rumeno / Leg Curl", "serie": 3, "reps": "8-10", "recupero": 12, "video": "https://www.youtube.com/watch?v=rdl1616", "note": "Alternativa per femorali" },
        { "id": "hip_thrust", "nome": "Hip Thrust / Ponte glutei", "serie": 3, "reps": "8-10", "recupero": 90, "video": "https://www.youtube.com/watch?v=hipthrust1717", "note": "Bilanciere o macchina – contrazione isometrica in cima" },
        { "id": "adduttori", "nome": "Adductor machine", "serie": 3, "reps": "12-15", "recupero": 60, "video": null, "note": "Adduttori – range completo" },
        { "id": "abduttori", "nome": "Abductor machine", "serie": 3, "reps": "12-15", "recupero": 60, "video": null, "note": "Abduttori – range completo" },
        { "id": "crunch_cavo", "nome": "Addominali: Sit-up / Crunch al cavo", "serie": 3, "reps": "12-15", "recupero": 45, "video": null, "note": "Weighted Sit-Up o Cable Crunch" }
      ]
    }
  ]
}
