{
  "id": "ipertrofiaintensa_02_04_2026",
  "nome": "IpertrofiaIntensa",
  "descrizione": "Fase 2: aumento densità e volume per ipertrofia intensa",
  "categoria": "Hypertrophy",
  "giorni": [
    {
      "giorno": "Petto & Tricipiti",
      "etichetta": "Petto/Tricipiti — Intensivo",
      "esercizi": [
        { "id": "panca_piana", "nome": "Panca Piana", "serie": 4, "reps": "6-8", "recupero": 150, "video": "https://www.youtube.com/watch?v=panca201", "note": "Intensità aumentata" },
        { "id": "panca_inclinata", "nome": "Panca Inclinata Mdb", "serie": 3, "reps": "8-10", "recupero": 90, "video": "https://www.youtube.com/watch?v=incline202", "note": "Massima apertura" },
        { "id": "croci_pec_deck", "nome": "Croci Pec Deck", "serie": 3, "reps": "12-15", "recupero": 60, "video": "https://www.youtube.com/watch?v=pecdeck203", "note": "Contrazione 2s in cima" },
        { "id": "pushdown", "nome": "Pushdown Cavi", "serie": 4, "reps": "12", "recupero": 60, "video": "https://www.youtube.com/watch?v=push204", "note": "Superset con estensioni" },
        { "id": "estensione_sopra", "nome": "Estensione Overhead", "serie": 3, "reps": "12", "recupero": 60, "video": "https://www.youtube.com/watch?v=over205", "note": "Manubrio singolo" }
      ]
    },
    {
      "giorno": "Schiena & Bicipiti",
      "etichetta": "Schiena/Bicipiti — Intensivo",
      "esercizi": [
        { "id": "trazioni_zavorra", "nome": "Trazioni con Zavorra", "serie": 4, "reps": "6-8", "recupero": 150, "video": "https://www.youtube.com/watch?v=zavorra206", "note": "Progressione con cintura" },
        { "id": "rematore_bilanciere", "nome": "Rematore Bilanciere", "serie": 4, "reps": "8-10", "recupero": 120, "video": "https://www.youtube.com/watch?v=row207", "note": "Presa supina" },
        { "id": "seated_row", "nome": "Seated Row", "serie": 3, "reps": "10-12", "recupero": 90, "video": "https://www.youtube.com/watch?v=seated208", "note": "Cavi bassi" },
        { "id": "curl_bilanciere", "nome": "Curl Bilanciere", "serie": 4, "reps": "8-10", "recupero": 75, "video": "https://www.youtube.com/watch?v=curl209", "note": "Progressione" },
        { "id": "curl_incline", "nome": "Curl Incline Mdb", "serie": 3, "reps": "12", "recupero": 60, "video": "https://www.youtube.com/watch?v=incurl210", "note": "Massimo stiramento" }
      ]
    },
    {
      "giorno": "Gambe",
      "etichetta": "Gambe — Intensivo",
      "esercizi": [
        { "id": "squat", "nome": "Squat", "serie": 4, "reps": "6-8", "recupero": 180, "video": "https://www.youtube.com/watch?v=squat211", "note": "Volume aumentato" },
        { "id": "squat_bulgaro", "nome": "Squat Bulgaro", "serie": 3, "reps": "10", "recupero": 90, "video": "https://www.youtube.com/watch?v=bulgaro212", "note": "Unilaterale" },
        { "id": "stacco_rumeno", "nome": "Stacco Rumeno", "serie": 4, "reps": "10", "recupero": 120, "video": "https://www.youtube.com/watch?v=rdl213", "note": "Enfasi femorali" },
        { "id": "leg_press", "nome": "Leg Press", "serie": 3, "reps": "15", "recupero": 90, "video": "https://www.youtube.com/watch?v=legpress214", "note": "Pump finale" },
        { "id": "calf_raises_unilat", "nome": "Calf Unilaterale", "serie": 4, "reps": "20", "recupero": 45, "video": null, "note": "Piede singolo per maggiore ROM" }
      ]
    },
    {
      "giorno": "Spalle & Core",
      "etichetta": "Spalle/Core — Intensivo",
      "esercizi": [
        { "id": "lento_avanti", "nome": "Lento Avanti", "serie": 5, "reps": "8-10", "recupero": 90, "video": "https://www.youtube.com/watch?v=ohp215", "note": "Incremento volume" },
        { "id": "alzate_laterali", "nome": "Alzate Laterali", "serie": 5, "reps": "15", "recupero": 60, "video": "https://www.youtube.com/watch?v=latraise216", "note": "Cable o manubri" },
        { "id": "rear_delt_fly", "nome": "Rear Delt Fly", "serie": 4, "reps": "15", "recupero": 60, "video": "https://www.youtube.com/watch?v=rear217", "note": "Deltoide posteriore" },
        { "id": "ab_wheel", "nome": "Ab Wheel Rollout", "serie": 3, "reps": "10", "recupero": 60, "video": null, "note": "Dal ginocchio o in piedi" },
        { "id": "hanging_leg_raise", "nome": "Hanging Leg Raise", "serie": 3, "reps": "12", "recupero": 45, "video": null, "note": "Controllo nel movimento" }
      ]
    }
  ]
}
