{
  "id": "forzebase_01_01_2026",
  "nome": "ForzeBase",
  "descrizione": "Ciclo base per forza e tecnica — 3 giorni settimana",
  "categoria": "Forza",
  "giorni": [
    {
      "giorno": "Push",
      "etichetta": "Push — Forza",
      "esercizi": [
        { "id": "panca_piana", "nome": "Panca Piana", "serie": 4, "reps": "6-8", "recupero": 180, "video": "https://www.youtube.com/watch?v=panca001", "note": "Presa larga, scendi al petto" },
        { "id": "panca_inclinata", "nome": "Panca Inclinata", "serie": 3, "reps": "8-10", "recupero": 150, "video": "https://www.youtube.com/watch?v=incline002", "note": "30°, manubri o bilanciere" },
        { "id": "lento_avanti", "nome": "Lento Avanti", "serie": 4, "reps": "6-8", "recupero": 150, "video": "https://www.youtube.com/watch?v=shoulder003", "note": "Seduto, bilanciere o manubri" },
        { "id": "alzate_lat", "nome": "Alzate Laterali", "serie": 3, "reps": "12-15", "recupero": 60, "video": "https://www.youtube.com/watch?v=latraise004", "note": "Controllo fase negativa" },
        { "id": "french_press", "nome": "French Press", "serie": 3, "reps": "10-12", "recupero": 75, "video": "https://www.youtube.com/watch?v=french005", "note": "EZ bar, gomiti fermi" }
      ]
    },
    {
      "giorno": "Pull",
      "etichetta": "Pull — Forza",
      "esercizi": [
        { "id": "stacco", "nome": "Stacco da Terra", "serie": 4, "reps": "4-6", "recupero": 240, "video": "https://www.youtube.com/watch?v=deadlift006", "note": "Schiena neutra, piedi a larghezza fianchi" },
        { "id": "trazioni", "nome": "Trazioni", "serie": 4, "reps": "6-10", "recupero": 120, "video": "https://www.youtube.com/watch?v=pull007", "note": "Presa pronata, petto verso la sbarra" },
        { "id": "rematore", "nome": "Rematore Bilanciere", "serie": 3, "reps": "8-10", "recupero": 120, "video": "https://www.youtube.com/watch?v=row008", "note": "Busto a 45°, tira verso ombelico" },
        { "id": "curl_bilanciere", "nome": "Curl Bilanciere", "serie": 3, "reps": "8-10", "recupero": 75, "video": "https://www.youtube.com/watch?v=curl009", "note": "No slancio dei gomiti" },
        { "id": "curl_manubri", "nome": "Curl Alternato", "serie": 3, "reps": "10-12", "recupero": 60, "video": "https://www.youtube.com/watch?v=incurl010", "note": "Supinazione completa in cima" }
      ]
    },
    {
      "giorno": "Gambe",
      "etichetta": "Legs — Forza",
      "esercizi": [
        { "id": "squat", "nome": "Squat", "serie": 4, "reps": "6-8", "recupero": 180, "video": "https://www.youtube.com/watch?v=squat011", "note": "Scendi sotto il parallelo" },
        { "id": "leg_press", "nome": "Leg Press", "serie": 3, "reps": "10-12", "recupero": 120, "video": "https://www.youtube.com/watch?v=legpress012", "note": "Piedi a larghezza spalle" },
        { "id": "affondi", "nome": "Affondi Camminati", "serie": 3, "reps": "12 per lato", "recupero": 90, "video": "https://www.youtube.com/watch?v=lunge013", "note": "Bilanciere o manubri" },
        { "id": "leg_curl", "nome": "Leg Curl", "serie": 4, "reps": "10-12", "recupero": 90, "video": "https://www.youtube.com/watch?v=legcurl014", "note": "Isometrico 1s in cima" },
        { "id": "calf_raises", "nome": "Calf Raises", "serie": 4, "reps": "15-20", "recupero": 45, "video": "https://www.youtube.com/watch?v=calf015", "note": "Range completo, pausa in basso" }
      ]
    }
  ]
}
