{
  "id": "athlon-2026-01",
  "nome": "Athlon Program - Sample",
  "descrizione": "Scheda di esempio generata dal template",
  "categoria": "Forza / Ipertrofia",
  "giorni": [
    {
      "giorno": "Giorno 1",
      "etichetta": "Petto & Tricipiti",
      "esercizi": [
        {
          "id": "panca_piana",
          "nome": "Panca Piana",
          "serie": 4,
          "reps": "6-8",
          "recupero": 120,
          "video": "https://www.youtube.com/watch?v=example",
          "note": "Scala il carico progressivamente"
        }
      ]
    }
  ]
}
