{
  "id": "ipertrofiaintensa_01_03_2026",
  "nome": "IpertrofiaIntensa",
  "descrizione": "Ciclo ad alta densità per ipertrofia: più esercizi/accesso al pump",
  "categoria": "Hypertrophy",
  "giorni": [
    {
      "giorno": "Petto & Tricipiti",
      "etichetta": "Petto/Tricipiti",
      "esercizi": [
        { "id": "panca_piana", "nome": "Panca Piana", "serie": 4, "reps": "8-10", "recupero": 120, "video": "https://www.youtube.com/watch?v=panca101", "note": "Controllo eccentrico 3s" },
        { "id": "panca_inclinata", "nome": "Panca Inclinata Mdb", "serie": 3, "reps": "10-12", "recupero": 90, "video": "https://www.youtube.com/watch?v=incline102", "note": "Massima apertura in basso" },
        { "id": "croci_cavi", "nome": "Croci ai Cavi Bassi", "serie": 3, "reps": "12-15", "recupero": 60, "video": "https://www.youtube.com/watch?v=croci103", "note": "Contrazione in cima" },
        { "id": "pushdown", "nome": "Pushdown Cavi", "serie": 4, "reps": "12-15", "recupero": 60, "video": "https://www.youtube.com/watch?v=pushdown104", "note": "Gomiti fissi" },
        { "id": "estensione_sopra", "nome": "Estensione Tricipiti", "serie": 3, "reps": "12", "recupero": 60, "video": "https://www.youtube.com/watch?v=tricep105", "note": "Overhead, manubrio singolo" }
      ]
    },
    {
      "giorno": "Schiena & Bicipiti",
      "etichetta": "Schiena/Bicipiti",
      "esercizi": [
        { "id": "trazioni", "nome": "Trazioni", "serie": 4, "reps": "8-10", "recupero": 120, "video": "https://www.youtube.com/watch?v=trazioni106", "note": "Ampio ROM" },
        { "id": "lat_machine_prona", "nome": "Lat Machine Pronata", "serie": 3, "reps": "10-12", "recupero": 90, "video": "https://www.youtube.com/watch?v=latprona107", "note": "Stretta presa" },
        { "id": "rematore_mdb", "nome": "Rematore Manubrio", "serie": 3, "reps": "12", "recupero": 90, "video": "https://www.youtube.com/watch?v=rematore108", "note": "Unilaterale, supporto ginocchio" },
        { "id": "curl_concentrato", "nome": "Curl Concentrato", "serie": 3, "reps": "12-15", "recupero": 60, "video": "https://www.youtube.com/watch?v=concurl109", "note": "Massima concentrazione" },
        { "id": "curl_martello", "nome": "Curl Martello", "serie": 3, "reps": "12", "recupero": 60, "video": "https://www.youtube.com/watch?v=hammer110", "note": "Presa neutra" }
      ]
    },
    {
      "giorno": "Gambe",
      "etichetta": "Legs",
      "esercizi": [
        { "id": "squat_bulgaro", "nome": "Squat Bulgaro", "serie": 4, "reps": "10 per gamba", "recupero": 90, "video": "https://www.youtube.com/watch?v=bulgaro111", "note": "Piede posteriore su panca" },
        { "id": "leg_press", "nome": "Leg Press", "serie": 3, "reps": "12-15", "recupero": 90, "video": "https://www.youtube.com/watch?v=legpress112", "note": "Piedi alti per femorali" },
        { "id": "stacco_rumeno", "nome": "Stacco Rumeno", "serie": 4, "reps": "10-12", "recupero": 120, "video": "https://www.youtube.com/watch?v=rdl113", "note": "Schiena piatta, enfasi femorali" },
        { "id": "leg_extension", "nome": "Leg Extension", "serie": 3, "reps": "15", "recupero": 45, "video": "https://www.youtube.com/watch?v=extension114", "note": "Full extension" },
        { "id": "calf_raises", "nome": "Calf Raises", "serie": 5, "reps": "20", "recupero": 45, "video": null, "note": "Pause al massimo allungamento" }
      ]
    },
    {
      "giorno": "Spalle & Core",
      "etichetta": "Spalle/Core",
      "esercizi": [
        { "id": "lento_avanti", "nome": "Lento Avanti", "serie": 4, "reps": "10-12", "recupero": 90, "video": "https://www.youtube.com/watch?v=ohp115", "note": "Bilanciere o manubri seduto" },
        { "id": "alzate_laterali", "nome": "Alzate Laterali", "serie": 4, "reps": "15-20", "recupero": 60, "video": "https://www.youtube.com/watch?v=latraise116", "note": "Drop set finale possibili" },
        { "id": "face_pull", "nome": "Face Pull", "serie": 3, "reps": "15", "recupero": 45, "video": "https://www.youtube.com/watch?v=face117", "note": "Protezione rotatori" },
        { "id": "plank_dinamico", "nome": "Plank Dinamico", "serie": 3, "reps": "30s", "recupero": 45, "video": null, "note": "Alternanza antebraccio/mano" },
        { "id": "crunch_cavi", "nome": "Crunch ai Cavi", "serie": 4, "reps": "15", "recupero": 45, "video": null, "note": "Contrazione addome" }
      ]
    }
  ]
}
